,ordinary_comment
95,剧情很水，特效很好，有几个场景特别温子仁，这是dc最传奇最神话的一部超英了，比神奇女侠还神话，所以还挺难有代入感的。零点首映简直了，每一个小高潮点出来的时候，就各种尖叫鼓掌，让我怀疑我根本就是一个小透明。
96,第一次首场，第一次午夜场，凌晨两三点的街道好过这部电影。
97,确实比DC宇宙之前交的那些作业高了一个层次，温子仁可以说是DC的救星了，还夹带私货玩儿了把恐怖惊悚，几个地方镜头美哭，但就是节奏太紧了，一直打打打乒乒乒咚咚咚，一点儿喘气的功夫都没有，看得特别累，看完也不知道海王究竟是个什么样的性格人设，可能是片方觉得，反正大家也不care，拼命露肉就对了？
98,一部融合了太多其他作品既视感的电影，反而失去了自己的灵魂。特效看着昂贵无比，却还是没有做出美感。温子仁的惊悚恐惧与DC的暗黑相辅相成，海王的美好肉体与撩人眉眼堪称一绝。已然进步不小，可究竟是否配得上漫天胡吹，还请各自心证。我到底还是爱DC，愿它越来越好。ps.那个充满肥美螃蟹小龙虾和鱿鱼的海底王国到底是什么美好天堂
99,Karathen太帅了！
100,喜欢海王的都是些性生活没有真正达到灵魂高潮的人~
101,大家是不是对口碑炸裂有什么误会，这部片明明是低幼童话啊，动画片的素质。第一部海王电影人物就立不起来，而且里面所有主要人物的人格都是扭曲的，不明白为什么满手好牌却要打成这样。如果只谈特效的话，海洋的部分有海洋馆和海鲜市场的感觉，亚特兰蒂斯文明是游戏效果。所有剧情都是被推着走，感觉未婚妻的角色完全有自己当女王的素质，还不如让这个混血小子傻乎乎的在陆地上陪着老爸喝啤酒呢。
102,首映排队领叉子，DC越来越标准商业效果片了。什么阿凡达？本人不爱（捂脸）。
103,大咕咕鸡看了肯定很高兴，海鲜打架
104,目前詹姆斯温最令我失望的电影……特效堆砌，音响轰炸……吃不消
105,整体满满的中二感，海王的智商还时不时下线，都8102年了还在玩上个世纪的爱情梗。亚特兰蒂斯完全满足了我的幻想，战争场面也很精彩，为了湄拉加一星。
106,在西西里打斗的两组长镜头设置很巧妙，连接反派视角和主角视角，主观视角和全局；但水下的镜头过于五彩斑斓和荧光色，有点游戏感，男主整体角色设置比女主逊色不少，没任何作为hero的personality，真应该叫《湄拉和她的副手》
107,看完海王以后游了个泳，感觉略有提高。看评论都在拿海王和阿凡达相比，我觉得差很多，因为海王里眼花缭乱的是以全景、王宫和各式武装战舰（军用科技）为主，只提供了一个新世界空壳，亚特兰蒂斯人怎么生活一概不知，而阿凡达的奇观大多是生活细节（民用科技）为主，观众随主角一起观光游历了新世界。两者趣味倾向截然不同。最喜欢的段落是西西里岛，这都不算奇观了，只是走马观花的异域。此外弱气小男孩转场就长成胡子鸡肉大叔也太惊悚了。
108,3.5 “那他就是你们的王”
109,挺好的，水的特效很耐看，虽然所有文戏都跟屎一样但是本来也不怎么指望所以反而ok，而且看到最后我居然也能接受这个金配绿的乡土审美了是怎么回事…but，黑蝠鲼是黑的我可以理解，但是一定要自己喷漆吗？不能更炫酷一点吗，比如变色啥的。（另外，硬要说的话，妮可·基德曼太高了，非常不得劲儿
110,我看出來了，海王不是大狼狗，也不是薩摩耶，是個哈士奇，花吃妹子是母的，正好配一對，千萬憋說不信，海洋生物真是太多樣了，克總都長螃蟹鉗子
111,很帅气的海底世界，和一个有点傻气的故事。段落叙事一点点展开，细节里总有点温导恐怖片的个人趣味。最后拿到三叉戟的过程也太容易点了吧！比起来还是更喜欢Jason Momoa的马王~三星半。
112,一群吹牛逼的海鲜
113,如果一场对话戏太长，就会被炸掉。
114,"嗯，143分钟的海王，有尿点，本来可以将两部电影的故事（安徒生童话前传+星球大战中部曲）生挤进了一部。DC的果然不是漫威口味的爆米花
惊喜点：海底世界生物大合集，还是超大型。譬如海马，就真的是马了，为啥纪录片里的都那么小只。海底暗黑系的赶脚还是蛮不错哒
不知道是惊喜点，还是槽点：
海底最可怕的怪物，已经不是大乌贼了，而是大乌贼和哥斯拉的结合体
妮可基德曼出来时，我是惊异的，竟然也参与了这类型的片子，说实话，有点穿越
武士发型出现的时候，我也是惊异的，这片子要混合多少风格
嗯，亚特兰蒂斯的士兵有点星球大战里克隆军队的赶脚，特别是武器
其实，我想不明白，就传统童话天赋异禀就好了啦，为啥这么高科技，亚特兰蒂斯真的科技范儿十足。估计我还陷在原始的古老波塞冬神话吧，嗯，还提到了匹诺曹，导演杂烩杂的厉害"
115,真的那么好看吗？剧情走向的每一个环节（就连笑点）也都太容易猜了吧，看的我全程冷静到打哈欠…唯一视觉上享受的是密恐那一段。评论一片赞叹我是看不懂了…
116,比较失望，特效应该是为剧情服务的，可这剧情真的很傻X，对白更是尴尬，看的我又晕又困
117,很矛盾的。特效很一般但是场面很宏大。演技很一般但是没有但是了。就是感觉一部电影融合了冒险科幻动作，仿佛看到了星球大战、指环王、碟中谍、西游记。拿金箍棒的美猴王战胜了虾兵蟹将。
118,老丈人计划通，不管兄弟俩谁掌权都能留一亩三分地。从软萌小孩进化为c罩兄贵的视觉冲击有点过于强烈了
119,8.1虚高得厉害，也就6水准。跟黑暗骑士差了16个神奇女侠。除了视觉，内核很空，可以更名为海鲜饕餮之王子复仇记，或者七海龙王之哪吒闹海，或者公主奇遇记之莫名我就爱上你。一杯热茶公主爱上了灯塔之子，一束玫瑰公主爱上了半血王子。DC花瓶比隔壁耐看很多，再次强调寡妇红发黑衣无人能敌。
120,"港譯名看來是譯女主安帕小姐,  她用啥水都可以!!  好看是男女主的化學作用, 很搭......紅色頭髪好看的女孩很少,  她已占頭牌......畫面好看預咗不能算優點,  反而紅眼怪最後遇到的亞洲科學家在蟻俠是FBI, 一人單挑兩大宇宙!!  最奇是魚佬擔心弟毀大陸, 是否多余, 陸人還有神奇女快快孩蝠娃呢....."
121,真的有剧情和人物塑造吗？节奏踩得是不错，剪辑也挺好，但最好看的还就是有恐怖片感的那一段嘛。
122,没有人物塑造。海王的自我认知可以深挖的点那么多，最后却沦为借助外物的升级，这就太斗罗大陆了。温子仁还是去拍cult吧，招魂多好
123,说实话dc没漫威好看，说效果好，也就那样电影全程黑漆马虎的，海里画面暗的经常看不清还有海底世界效果让我想起了孙悟空去找龙王，连里面的小兵都像出自日本漫画或者电影很山寨，电影经常突然出现个什么把你吓一跳，看起来让我想起电锯惊魂也难怪导演是同一个人，没有想象那么好，也不知道豆瓣评分是不是被刷上去的，故事线就是跟黑豹类似，中间男主和女主穿越一会儿沙漠盗墓一会儿到意大利小城镇房顶跑酷，东拼西凑的，唉，挺失望的，个人感觉不喜勿喷
124,跟漫威学搞笑路线么？然而笑点尴尬，剧情也莫名其妙，不过温子仁拍的动作跟画面还是很棒的。DC估计是回不到以前的样子了，还是继续看动画片吧。
125,无感。难得一个父母双全的主角……
126,这部片与mw今年片的区别在于，这部片真的打动我了，虽然他有些方面还是很套路话化，还有点尬算不上上乘之作。但至少我看到了温导的诚意和dc的改变。
127,初雪的上海 趕赴一場講述愛與成長的故事 視效走心 大洋逐個過場  偶有幾句質量過硬的句子  西西里島的古羅馬雕像是最下案頭功夫的了 劇情 人物性格簡單  台詞和戲份均少的亞瑟生父深情到難以忘懷
128,哈哈哈哈哈哈，三星全给特效！海王还是没穿金皮甲的时候可爱～故事稀烂就当爆米花电影看看过过眼瘾就好啦！
129,"这不是我想要的DC电影，就一大爽片无脑嗨，估计又是一部中国票房超北美的电影，希望票房好了还能有TDK,MOS,BVS出现吧"
130,一部具有温子仁特点的非典型性英雄大片。（海王的老爹造型实在是太弱了，陆地戏份一般，但进入海洋之后就开始奇观呈现。很多镜头转场、剪辑等亦非常可圈可点。）
131,虾兵蟹将的内战，会多国语言的陆上海下都吃香，最牛B的招数叫做同声传译。湄拉是女司机之光，反派的父子情居然感动到蜗了，无敌风水轮跟前面的特效比弱了点。海底的视效毫无侧重点导致审美夜总会。最大槽点是海王的任命是在海面/陆地上的，为买票入场的吃瓜海洋群众们表示不平。ps:细节不到位，跟朋友们一边看一边吐槽是另外一种欢乐 2333
132,3.5
133,空洞的精致英雄片。
134,老套 2018.97
135,好失望 除了几场的画面以外 一无是处
136,全程像在看异星电影，说吧，你们向86版《西游记》学了多少~
137,18127#跑酷像在看速极，鱼爬上船像在看恐怖片，女主角的红发就是典型的人鱼形象了吧，海王最后的黄金鳞片简直太难看了，妮可基德曼很美反正我喜欢，其它这个那个没什么太明显的缺点，就是太无趣了，中间真的看得我以为要睡过去了，不骗你
138,"憋了这么长时间，还是说点题外话吧。
超级英雄，更爱日系，日系更爱奥特曼，奥特曼更爱昭和系，昭和系更爱赛文，赛文更爱《我是地球人》，因为有人文关怀，有历史反思，有人与自然的二元辨析。
美系不是没有扛把子，而我只认没有超能力的蝙蝠侠。蝙蝠侠只爱黑暗骑士系列。
此后，漫威也好，DC也罢，陷入了票房，政治正确，IP等太多窠臼，矫情点说，忘了人本。
即便复联系列，看似高屋建瓴，俯瞰人世，也不过是“救世主情节”的反其道而行之。
现在这世道，恶人遍地，也只能在大荧幕上自慰。
算了，你们开心就好。"
139,叉王争霸战之混血王子。嗯，什么避水金睛兽，母夜叉，虾兵蟹将章鱼怪，鲨鱼精海带精悉数登场。瀑布后面去找金箍棒，不，亚瑟王找的是石中剑，也不是，是他太姥爷波塞冬留下来的五股锻金矛尾钢叉。话说这叉自带装甲属性，一旦蓝牙配对，就附送一套贴身软猬金甲。这片子顺便还解决了一道世纪难题，女友和老妈一起掉水里先救谁——结果是老妈把女友救上了岸。仙女老妈对银甲弟弟说，别和你哥哥争王位，你发型好可装备不行啊～女主老爹本来还带着一队金枪鱼来裹乱，一看自己闺女和男主好上了，心说总算闺女可以嫁出去了，还能混个皇后，立马就大叫，以后这个就是王～
140,公映3D
141,我是越来越不喜欢看3D了。前些年也被《阿凡达》惊艳过，近年印象深刻的则有《奇异博士》，但总体而言，不知是3D技术做得越来越水，还是院线的3D设备越来越省钱，总之是画面越看越蒙，色调越看越暗，都快把人搞成睁眼瞎了。再说影片本身，大片我看得真的太少了，但还是能看出来它有时像《阿凡达》有时像《千星之城》有时像《超级玩家》，惊叹往往只是一瞬间，马上就会被似曾相识所取代。另外它构建的海底世界，在个人想象中应该是以蓝色为主，围绕这一冷色调所作的构思也应该以冷兵器为主，可在本片中，海水里面动不动炸出一团火球，火焰和燃烧的介入，把海底和太空都快混淆了，特别是色彩这块，和个人理解的海洋的美感，还是相距甚远。
142,"完全是一个普通的科幻电影被豆瓣弄得虚高了，特效依然是非常优秀，打斗场面依然是震撼，但剧情好像简直是从儿童书上面搬出来的，至于画面就好像是各种影视的结合版，整部影片都好像是在为人类的罪行辩护，期待影片能把主题上升到环保，期待海王能解决人鱼共存的问题，期待海王可以现在联合国的舞台上……结果最后人类不知道有鱼人最后还不知道有鱼人，影片完全是接着“海洋”的壳，演了一场君王争夺战，虽然发起战争确实不对，难道不跟人类打就能解决问题吗？
海王争夺到了王位，他真的争夺到民心了吗？秦汉时选官是看出生的地位，想不到DC也玩这把。本以为彩蛋可以告诉我点什么结果就是个超级英雄电影最标准的彩蛋。
但我依然讨厌用看文艺片的标准来看待科幻片，整部片子的画面，导演也算是用心了！"
143,镜头很温子仁 剧情各种牵强 又被营销了 
144,1.视觉效果很牛逼  2.炫目的海底世界也不能掩盖故事的单薄  3.在一定程度上证明了混血儿的基因优势（？）  4.海王的魅力太弱，比不上又美又酷的公主，最后的考验靠嘴炮，还证明了终极决斗里装备很重要  5.不抱过分期待去看还是可以爽到。7分。
145,很多中国元素，海王很帅，战衣很丑，大金链子既视感。打斗戏不吸引我。最喜欢的一段反而是海王和红发女在西西里岛闲逛。剧情主线上，我觉得开头是反血统论的，但落脚点又还是血统论了。一些剧情硬凹，什么单向门啥的。最后就是作为一个环保片，人类没受到啥教育嘛。海底下打得生灵涂炭的陆地上人们还啥都不知道。
146,温导你能不能专心去拍恐怖片？这部电影唯一的优点就是看起来很好吃，那个大钳子和触手是椒盐好还是清蒸好呢？
147,豆瓣8分是认真的吗？大概是对胡子拉碴，满身都是纹身的男主第一观感就很差……特效真的惊艳，海底美轮美奂，女主也蛮美的，包括男主他妈也蛮美……不过故事真的简单的不能再简单，也没什么新意…
148,吹过头了……郭敬明的配色，爵迹的3D 动作，不像一部电影，也不像好的动画片，差不多更接近一部游戏的动画那种水平。这部游戏应该抄了雷神，狮子王，西游记，圣斗士（海皇篇）等等。目测没找中国的动作指导，打起来特别土。如果黑客帝国的格斗技术跟孙悟空差不多，那么海王也就到了 NBA 球星打架的水平
149,特效很棒，故事一般，如果我是弟弟，大概会气死：事业事业没了，爱情爱情黄了
150,一个大男孩被媳妇和老妈push得让人心酸 明明他不想要那个王位和那把大叉子。身边好多东北女的就是这样，头拱地也要让老公和儿子有出息，不惜自摆苦肉计道德绑架老公和儿子。最后一刻他还在迷茫地问她媳妇：我打赢了然后该干啥？媳妇骄傲地站出来宣布自己老公赢了要称王，红发老丈人第一个俯首称臣
151,真的对什么“史诗”“宏大”“巨作”无感，凭什么让观众去理解和学习一切都是基于人类世界认识观出发的片子？？
152,3.5/5 真心觉得在看西游记东海龙宫，水族馆里的鲨鱼好可爱啊。温子仁把弟弟出场弄得好帅，但后面那个黄金圣斗士妆什么鬼。美术巨精分的地方就是独角兽色和夜店色用得不错啊，但金色用得都好jb丑和山寨！真的太受不了最后那个金甲圣衣了啊啊啊啊啊啊，继续让杰森摸吗光着不好么！我站（老）小王子啦，最后来一句“爱拯救世界”（WW也有这句，一毛一样！我当时还吐槽过这话要演出来不要念台词念出来）并没解决垃圾陆地人专坑海族这件事（中间n次被突然爆炸吓一跳，基友说是温子仁恐怖片拍多了233333
153,DC版牛郎织女后传吗？海王的人设多少有点像雷神。说实话看了预告很失望，但正片倒是好看的，至少爽感做得不错，最喜欢西西里岛上那一段，还是有些创意的。不过两个关键的转折点靠的全是“命中注定”？这种套路也是让人瞠目结舌，导致我后来对于反派奥姆王产生了某种同情。还有就是主题是“同一个世界同一个梦想”吗？愿景是好的，但左得有点过头。
154,七分。海底两万里的特效 人兽鱼舰的战斗都是极好的，但是缺少故事 看不到海王的成长。导演没有讲海王与父亲的感情 也没有仔细讲海王的心理变化 就算被推着走 也没有给出足够的动力。好作文从来不是靠把字写漂亮拿的高分
155,不能说不说好但是就分数来说，对好多七分多的电影不公平。咸水族，海鲜大咖来咯，客官里面请。琥珀美，比年轻的基德曼还美。
156,对超英电影已经无感了，尤其是这部电影在水下没有物理概念的夸张感觉很脑残。
157,感觉如今超英片难有突破啊，故事和中规中矩，但是视效非常棒，有的时候会觉得自己再看space film，1.6亿，温导绝对是成本控制高手。奥姆挺惨的，亚特兰蒂斯之王被身边的所有人背叛，而且是从小背叛，但是导演待他不薄，最好看的打斗场面是跟着他的脸拍的，啧啧啧。其实与其说这是aquaman诞生记，不如说这是King Arthur成长记。以及，我特别喜欢第一次梅拉带亚瑟去海里，集装箱旁边漂浮的啤酒包装塑料这种细节。人类啊，善待海洋一点？edit:昨晚仔细想了想，发现我还是真的不喜欢这种武力决定权力，born to be的人物。完全看不懂Vulko的人物逻辑。
158,剧情一般，特效惊人，主角养眼，雷神同款男主+蚁人2老妈没死桥段+黑豹兄弟争权戏码
159,比黑豹难看3倍
160,都是套路，但是看得很高兴~
161,除了没剧情，其他什么都有，温子仁目的性很强，而且大抵比较成功。
162,海娘家里打架、海王兄弟首次干仗、意大利小岛追逐、海洋生物大战四处小长镜头调度值得欣赏，温子仁标志性的跟随目标侧转镜头开场潜艇内已展示，以及突然惊吓。接下来全是缺点，奇观和世界观的堆砌，硬要把不可能容下的东西塞进一部，不停地科普背景、不停的堆砌奇观，不是在打就是在说，基本做到了但凡能说出来就不靠镜头叙事，最好是边说边闪回一边儿有画面一边儿口头儿讲解，标准的反电影主义者阵营大餐。一部好莱坞大片儿看完不知道主题音乐是啥，哼不出来，已经说明问题了，没有主题的电影难有带主题的音乐，东一榔头西一棒子的剪辑和过多条线，都难以让配乐做到每段与每段衔接，相映成趣就别说了，根本就是一花一世界，一段一旋律，不但如此还致力于章章都带感，段段都起范儿，完美做到了段子电影的高度。
163,收回五星预评。四星上限了。剧情实在平庸到无趣，没有半点嚼头，人设方面海王身为主角还没有正联出场来得有意思，光芒全给周围的人盖掉了。视效上瑰丽的场景全在海底…不过没有达到我的预期。配乐除了引用开头西瓜肉丝的那首就没有令人欣喜的了，还是很平庸，达不到BVS Hans Zimmer的万分之一（为扎导不值，厚重的经典因为众人不懂欣赏就低评，纯迎合大众的炫视效之作就炒热）。最后…全篇我唯二喜欢的是奥姆和黑蝠鲼我会说？
164,2.5吧，每个场景都跳脱啊，各种不搭，看得一路睡着。。。
165,特效很牛。故事就是爆米花了。
166,好中二的片子&妮可基德曼都演男主他妈了...
167,迪斯尼风格的春晚合家欢，色彩比老谋子还鲜亮。适合领小学以下小朋友去看。
168,#ComboPack##BestValue##Amber演啥都美##除皱厉害#温导解放摄影机的手法好Literal……然而节奏感即使单场戏里也很糟糕啊，而且音乐啊不是一切声音的品味SUCK ASS#SkylarIStillLoveYa#
169,( ･᷄৺･᷅ )唔。。。可能我越来越挑剔了 画面是绚丽无边，但是这个剧情真的让人起不了波澜，永远都能想到下一秒故事进展。虽然一直是个声效画面控，但是故事无法让我有哪怕一丝丝的触动的影片，我也还是会只给3星而已。诚意满满值回票价是真的，boring也是真的。就，所有的英雄大片都要有主角或者配角是混血，另一个对主角生出妒恨然后打打打的框架模式吗？越来越觉得一直喜欢的杰克船长多么独特，亦正亦邪不务正业的主角才是真的超有趣阿。【以及，我笑点太高了？真的是全程面无表情看完，所谓的笑点部分真的。。。呃 尬】
170,妮可扮相粉嫩得，感觉海马和帕帕都是她男朋友，抱着头母子情深的场面总感觉要亲上去了——尤其是跟帕帕说I love U的时候……好变态
171,挺中二的，不得不承认温子仁给DC宇宙里的严肃癌打了一支发骚针，整个观影过程被杜比全景声之类的音浪轰得我东倒西歪，感觉空气都在发浪，但论精彩的除了男主亮相时的媚笑，以及从悬崖上摔下去的弱爆了的铁皮小黑哥惨状，其他也没什么印象，温子仁保持了一贯力拉崩倒的气势以及能省则省的制片观，会算账的导演还是蛮重要的
172,故事老套，也就特效还不错而已
173,这种大概就是不太有感但为了场面必须去影院看的电影。故事弱的没法说，服装道具觉得是3D打印的，最后海王一身成熟玉米装出来简直了。
174,好像很一般啊，几个旅游观光片+一阵洞洞光光轰轰
175,好像儿童片……
176,龙宫征取定海神针。既然都温子仁了那海王他妈应该让维拉法米加演啊
177,三星半，并没有传说中的惊艳，只能说是一部完成度还不错的商业片罢了，与阿凡达这种开创宏伟新宇宙世界观的类型片根本不是一个档次的。片子场景借鉴了很多阿凡达和海难片的架构，人物造型则是阿凡达+异形+超级英雄+星球大战+星际争霸……，故事情节是三千里寻母记+哈姆雷特+欢喜冤家+夺宝奇兵……标准拼凑商业片的模式，不知道为啥那么多人沉醉于男主的身形和他爸妈的狗血恋情中……
178,特效牛逼哄哄，剧情还是有点弱，就是黑蝠鲼怎么弱鸡成这样了？？？尤其是那个头盔，看一次笑一次……
179,"“我不想当国王”
“我不想当国王”
“我都说了我不想当国王，你们别逼我了”     
“真香”"
180,就是把西游记 指环王 加勒比海盗 木乃伊 哈利波特 功夫熊猫 侏罗纪公园 星战等多部类型片的次要设定凑一起的片嘛，，
181,一颗星特效，一颗星视觉奇观，一个星表演。 大制作剧本套路一点可以理解，不过这音乐品味啊、人物弧光啊……海沟族才是正片开始
182,238/优缺点十分明显了 吹的还是有点过罢 炸裂的特效也挽回不了剧本的平庸 anyway仍是一场视觉盛宴 imax看的很爽 以及被湄拉的颜圈粉惹
183,哈哈哈这电影看得我很想吃海鲜大餐诶！海沟国的拿来油炸，撒辣粉。咸水国的避风塘或者清蒸。餐具当然用黄金三叉戟。老公看了1/3就睡着了，我说，你必须把自己的智商调节到五岁，一切就很精彩了！
184,剧情本身非常的简单和无聊，全靠宏大精美的特效撑起全片。男女主完全不来电全程尬聊，还穿插各种生硬的笑点。男主柔情铁汉萌萌哒的人设也很失败，耍宝卖萌充满违和感。三星全给特效和想象力丰富的海底奇观。
185,3.5，温子仁有点徐克的意思，用填鸭式奇观喂饱视听，深海元素不可谓不琳琅满目，夜景飙车，角斗爆炸，夺宝决战，样样都是大场面，但似乎缺了些深海式的alien感，总还是虾兵蟹将版的三百勇士，倒是西西里跑酷在两个平行舞台调度，相当炫技。英雄叙事在异域环境内爆发视觉大秀，试图用超能将人的困境延展为史诗。
186,都准备买票了，才发现北美比中国晚上映两个礼拜，好气哦🙄
187,妮可基德曼出现时，那身亮片贴身衣服呀，这审美是有大西洋底来的人那么古老吗。爱情、亲情都没空表现了，只有配色土得掉渣的海底特效可以看看了，所以一定要选个舍得用电的影院。
188,杰森嫁（cao）我。
189,7.5 开头亚当斯虐文斯卡特把我看乐了。君权神授什么的太无聊了，拯救世界的方法是杀一大堆同胞也够了，还是搞克苏鲁怪好一点。衣服是丑了点，不过画面绚烂，作为商业片显然是合格的。
190,每一帧都是特效，每一秒经费都在燃烧。海沟族那段夹带了些恐怖片手法的私货，新奇。剧情偏弱，场面宏大不等于格局宏大，比起蝙蝠侠黑暗骑士还是差远了。
