,ordinary_comment
191,一部大杂烩。/海王的大招不过是齐天大圣的基本操作嘛。
192,讲的是一个人，靠着尊贵血统和运气，没怎么努力就获得了无上权力并且抱得美人归的故事，吹得太过了，高饱和度的打斗场面显得俗气，看的眼花，服装武器建筑没有充分展示海底世界的特点，搬到太空一点都不违和，加分点是完成度还行，摄影不错，零星几个打斗场面还算精彩，以及两个女神颜值能打，7/10
193,特效是厉害的，剧情是赶的，人物是没有说服力的。几段戏拿出来看蛮不错的，mera和arthur在西西里和在沙漠的几段戏还是挺可爱的。粑粑麻麻导师都没死，有点不习惯了（另外弟弟也太老啦！
194,[世界][亚瑟·水行者]获得全服第一把橙武[亚特兰蒂斯之失落的三叉戟]
195,同是苦大仇深的身世、同是艰难的为正义而战，温子仁导演的加入，并没有改变DC严肃暗黑的主基调，不过却为影片抹上了一道亮色，比如“海王”本尊的救世觉悟就并没那么高。该片视觉特效的想象力及影像奇观的呈现的确很牛，说是海底版《阿凡达》《指环王》《星球大战》《侏罗纪世界》《速度与激情》…都毫不夸张。好吧，那场的海鲜大战确实唬住了我！但影片的故事则老套，可以看到N多影片的影子，比如漫威《雷神》《黑豹》“兄弟相杀”的主线结构及人设，比如《黑豹》那样明明无敌高科技却以传统的打架来决胜负，比如有咸蛋超人的中二风格，比如海王与三叉戟就非常雷同我们的孙悟空与金箍棒（水帘洞都一样）…另外，片中各元素塞得满满，片长143分钟略疲惫。其中男女主角的爱情戏颇为失败，还不如父辈那一小段爱情戏来的动人， 妮可·基德曼魅力也秒杀女主
196,非常cliché，明明已经是海底生物却穿盔甲，一股山寨星球大战的感觉；而且明明有魔力却用冷兵器打来打去，最后还是谁力气大谁赢，8102年了啊。
197,海鲜盛宴！！！濑尿虾和章鱼扭打在一起了！！！海蟹！！！海蟹军团出现了！！！天呐你看那个蟹钳又肥又厚！！！咸水国的子民看起来都很适合清蒸！！！加点料酒葱姜蒜都不用放盐！！！最后绝杀大招是跟悟空学的吧！！！天呐看完之后太想吃海鲜了！！！
198,纯娱乐片，有点看大闹天宫或哪吒闹海的错乱
199,贼尖儿无聊～几度串戏到 千星之城～可以说跟千星之城一个毛病：主角毫无魅力还又臭又长
200,海王亚瑟没欲望，国王奥姆没脑子。几个段落是打不过弟弟，抢弟弟女人，找到妈妈拿武器，干掉只会人海战术的弟弟成为王……
201,万达IMAX  特效不错，故事老套，都8102年了还是兄弟争权夺女人
202,因海王过分相似徐锦江而无法投入剧情
203,视效场面可看，故事老套粗暴，反派槽多无口。观影过程中脑海蹦出：孙悟空、沉香、张无忌、印第安纳·琼斯、少年派、黑豹、霍比特人史矛革、小美人鱼红发绿身配色、《蚁人2》和《驯龙高手2》的妈梗、《星球大战》暴风兵装备、海绵宝宝去珊迪家戴的水头盔……超英弟弟多混账，当哥的能咋办还不是选择（揍几顿）原谅他？发现海王演员眼睛有点外斜视，大银幕看略明显；居然没等到威廉·达福和妮可·基德曼的感情戏，我已经脑补了三千字女王忠犬文啦。
204,很一般啊，故事太四平八稳，可以说是偷懒了，特效还不错，但也看得人内心毫无波澜。但拿来和阿凡达比，真不知道想法怎么来的。场景必须为剧情服务，否则太无趣。
205,吹，继续吹……感觉整部电影导演只有在拍密集怪物袭击船的时候做回了自己很开心。
206,失望
207,场面宏大炫丽，场景布置道具设计都很用心多元，可惜也可惜在设计的多元上，冷热武器的对撞没有装出火花反而让打斗别的更加混乱，审美疲劳后则新鲜感全无。再加上剧情和漫威的黑豹同质化严重，只能说完成度比较高。温子仁的御用男主反派当的真窝囊。
208,咋个再多的特效也无力解救剧情的孱弱……
209,"还是没有办法get温子仁啦。（据说温子仁只用了1.6亿美元的预算，好了，省钱小能手，我get到了！）
前半段比较温吞，后半段才好看起来，片子实在太长了。
视效和动作设计真没话说，水中镜头本来就比较难做，最后这个效果算是超出预期啦。

海王的经历告诉我们，掌握好一门外语是多么重要。语言不仅仅是连接两个世界的桥梁，更代表着对两方世界的尊重。所以这部片子其实给缺乏身份认同的混血儿指明了一个新的方向——外交需要你们。
Nicole虽然正面有点僵，但侧颜无敌杀。"
210,可能期望有点高，并没有觉得剧情特效特别好看。但是男女主的颜值身材都太是我的菜了～另外青年海王有点像最近头发超级长的坤哥……哈哈哈
211,海洋和陆地的孩子连接海洋和陆地，故事和人物传统正派到不行。看人物在水里讲话总觉得他们嘴里应该冒出泡泡，全程觉得自己快要憋死了，另外最后的金色盔甲不能直视。
212,被豆瓣评分给骗了，失望，套路。别拍下一集了，反正我不看。最喜欢的是海马。
213,好费钱噢？？爆舔胸肌腹肌人鱼线一分、Nic颜值一分、海鲜大杂烩一分、什么？惊喜的剧情？不存在的
214,发现温子仁不可信 还是去拍鬼片吧… 这审美没谁了 通篇大写的尬
215,我对五光十色的特效没有意见，我对温导的恶趣味没有意见，只是当Aquaman穿得跟个穿山甲一样在海里大杀特杀的时候，我会怀念那个纠结许久，痛苦地拧断自己最后一个族人脖子的超人。而现在，好像只要Amber Heard半个奶子甩在眼前一切就都顺理成章地发生了，我们的英雄就轻飘飘地成为了海王。Long Live Marvel!
216,把宇宙战舰搬到了海底的感觉，但是很多地方觉得非常尬，而且剪辑至少4~5处很突兀，看的时候都觉得是不是这么多好评都是刷的啊……
217,爱好和平，天下无敌（翻个白眼）。
218,虽然海王很帅，不过确实很沙和尚啊？这种片子七分多差不多了
219,作为前传剧情套路.段落感明显.仪式化的场景呈现不断强调其传记史诗定位.沿袭DC一贯以之神如何为人的脉络.温子仁擅长的惊吓桥段让情节始终保持张力.海沟王国母女重逢力取三叉戟的桥段魔幻至极仿佛穿越加勒比海.驾驭八尾神兽独战众王的宏大炫丽场景媲美中土混战.情感线太扁美中不足.服化道略雷
